renderedContent,pre_processed,label_sentiment,probability_sentiment,label_emotion,probability_emotion,label_irony,probability_irony
"for the ppl who don’t believe summer walker, I have anxiety and recently (about a year ago) it shifted to include social aniexty. while I am very good at making small talk and interacting with people I hate it. So it’s possible but if I don’t want to... I 👏🏽 DONT 👏🏽 HAVE 👏🏽 TO 👏🏽",ppl believe summer walker anxiety recently year ago shifted include social aniexty good making small talk interacting people hate possible want dont,neutral,0.5446709990501404,sadness,0.9158669114112854,non_irony,0.6924309134483337
I. Fucking. Hate. Social. Anxiety.,fucking hate social anxiety,negative,0.9794856905937195,anger,0.8860679268836975,irony,0.6653470993041992
The worst part of my social anxiety is the constant fear that people secretely hate me. You start to over-analyze every interaction and start to be distant/antagonistic in your own behavior towards these people.,worst part social anxiety constant fear people secretely hate start analyze every interaction start distant antagonistic behavior towards people,negative,0.9484236836433411,sadness,0.5242930054664612,non_irony,0.6647547483444214
legit told her ‘i hate people i just don't wanna interact with them’ like i didn't know how to tell her i have social anxiety:(,legit told hate people wanna interact like didn know tell social anxiety,negative,0.834368109703064,anger,0.7094599604606628,irony,0.679111897945404
i've become that person that always cancels on their friends :( i hate myself so much. why do i give into fears? why does my social anxiety always act up? and why does food always have to be involved?,become person always cancels friends hate much give fears social anxiety always act food always involved,negative,0.9354572892189026,sadness,0.8489662408828735,non_irony,0.8034507632255554
"I honestly hate a “don’t call me, text me” ass bitch. Idk, but I like to have conversations over the phone. And sometimes things can get misconstrued over text. When did everyone begin to have such a social anxiety that you can’t even answer your god damn phone?!",honestly hate call text ass bitch idk like conversations phone sometimes things get misconstrued text everyone begin social anxiety even answer god damn phone,negative,0.9814525842666626,anger,0.9721914529800415,non_irony,0.8916422128677368
"i hate being shy,,, s/o to social anxiety hehe",hate shy social anxiety hehe,negative,0.7376753091812134,sadness,0.9089478254318237,irony,0.7087118029594421
"I hate people that use mental health as an excuse for their trash personality..

I’ve heard someone recently say “Oh I’ve got social anxiety issues which is why I don’t speak to people. It makes me feel funny when I... facebook.com/781190231/post…",hate people use mental health excuse trash personality heard someone recently say oh got social anxiety issues speak people makes feel funny,negative,0.7535733580589294,anger,0.6780030727386475,irony,0.8267645835876465
"Although imagine me ever doing PE, I hate it. It’s a person with social anxiety worst night nightmare.",although imagine ever pe hate person social anxiety worst night nightmare,negative,0.9345778822898865,sadness,0.7906314134597778,non_irony,0.7167485952377319
you know I went through a lot of therapy for my social anxiety disorder and I got a lot better but every now and then something makes me so anxious I feel like throwing up and I hate that,know went lot therapy social anxiety disorder got lot better every something makes anxious feel like throwing hate,positive,0.45564401149749756,sadness,0.9223862290382385,irony,0.8999148011207581
"@Mudavaye I think it's an anxiety thing like social anxiety. You know you *shouldn't* be worried that saying ""I actually prefer chocolate milk"" will make your crush Taylor hate you, but you get worried AF anyway.  #AnxietyLogic",think anxiety thing like social anxiety know worried saying actually prefer chocolate milk make crush taylor hate get worried af anyway #anxietylogic,negative,0.7700856924057007,sadness,0.9501274228096008,irony,0.5834823846817017
"@RadioFreeTom Adherence to white supremacy and racial anxiety will have you buying fake gold coins from a conman, wanting to get rid of social security, even though you subsist on it, and worshiping an orange false idol bc he normalizes your hate",adherence white supremacy racial anxiety buying fake gold coins conman wanting get rid social security even though subsist worshiping orange false idol bc normalizes hate,negative,0.915851891040802,anger,0.9609970450401306,irony,0.9194742441177368
"Does everyone hate me?
my brain w/ crippling social anxiety: twitter.com/chanbanhi/stat…",everyone hate brain crippling social anxiety,negative,0.9763844609260559,anger,0.5098850727081299,irony,0.8939756155014038
"Anyone that knows me in real life, not social media, knows I hate attention it gives me anxiety.",anyone knows real life not social media knows hate attention gives anxiety,negative,0.8276066184043884,sadness,0.7431687712669373,irony,0.6783415675163269
LITERALLY FUCK MY SOCIAL ANXIETY IT CAN SUCK IT I HATE IT SO MUCH,literally fuck social anxiety suck hate much,negative,0.982507050037384,anger,0.9291528463363647,non_irony,0.7283840179443359
"@missbethanymae Honestly.. I hate this. My social anxiety gets in the way of so much. Like I KNOW I should leave my house and socialize, but instead I just take myself on dates :(",honestly hate social anxiety gets way much like know leave house socialize instead take dates,negative,0.9378157258033752,sadness,0.4910288155078888,non_irony,0.8489107489585876
"I hate being in a class, I have social anxiety yet I love to party..",hate class social anxiety yet love party,negative,0.5696144104003906,sadness,0.7106304168701172,irony,0.8558019399642944
"@Zophael I hate having to go out and do something it's like wow great as if my social anxiety wasn't already enough. 
feel that pain you're feeling",hate go something like wow great social anxiety already enough feel pain feeling,negative,0.4835105538368225,sadness,0.9130794405937195,irony,0.929007887840271
Ugh I hate having social anxiety. I just saw a woman drop $150 from her purse but I was too nervous to tell her so now I have to keep it 😞 this fucking sucks man.,ugh hate social anxiety saw woman drop purse nervous tell keep fucking sucks man,negative,0.9813598990440369,anger,0.9464042782783508,irony,0.6491588354110718
"Do yourself a high favor, STOP ❌🚫 falling for Opts trigger posts/pics going into 2020. 

Fake vids, fake news just to raise your depression, fear &amp; anxiety. 

They practice &amp; play off your emotions. Division, fear &amp; hate.

Wish U discernment or Social Media not for ya",high favor stop falling opts trigger posts pics going fake vids fake news raise depression fear amp anxiety practice amp play emotions division fear amp hate wish discernment social media not ya,negative,0.8483911752700806,sadness,0.92745441198349,non_irony,0.5612806081771851
I hate that I have social anxiety now but I also hate being alone. 🥺,hate social anxiety also hate alone,negative,0.9673261642456055,sadness,0.7966580390930176,non_irony,0.6452304720878601
"@AshleyMacolee @thickynicky2309 @mxddsx @JessicaLeeCanty @Shaizard @abqjrr @Jaclynhill @JeffreeStar again i’ll say how many times do you all have to repeat the same shit ? taking a break from social media because you’re receiving death threats &amp; hate mail 24/7 when you already have anxiety &amp; other issues isn’t running away, it’s protecting your mental health.",say many times repeat shit taking break social media receiving death threats amp hate mail already anxiety amp issues running away protecting mental health,negative,0.9594960808753967,sadness,0.6501623392105103,non_irony,0.668720543384552
"I hate people who know I have depression and anxiety and don't consider that I'm disabled, can't have normal social relationships, social and career aspirations, and think it was my choice to be in this pathetic state I am in life now",hate people know depression anxiety consider disabled normal social relationships social career aspirations think choice pathetic state life,negative,0.721481204032898,sadness,0.9644293785095215,irony,0.7785663604736328
i hate my social anxiety and wouldn't wish it on anyone but some people really could use a little bit,hate social anxiety wish anyone people really could use little bit,negative,0.8658026456832886,sadness,0.9449865221977234,non_irony,0.7635891437530518
"Imma goin to therapy... I hate therapy sm... but that's the only way to get better and more stable mentally
But my fcking social anxiety always on it to make things worse

Wish me a good luck",imma goin therapy hate therapy sm way get better stable mentally fcking social anxiety always make things worse wish good luck,negative,0.9109190106391907,sadness,0.9320951700210571,non_irony,0.6716246604919434
Hello I HATE that my brain is telling me that going to a cafe on my own is the scariest shit ever so I'm gonna do exactly that today....social anxiety can suck it🙃,hello hate brain telling going cafe scariest shit ever gonna exactly today social anxiety suck,negative,0.9773053526878357,sadness,0.8290528655052185,irony,0.5989458560943604
I hate that I struggle with anxiety and social awkwardness on a daily basis and then I look weird when I subconsciously outcast myself from my own fucking friends then I feel weird when they try to include me because I’m used to being excluded and pushed away,hate struggle anxiety social awkwardness daily basis look weird subconsciously outcast fucking friends feel weird try include used excluded pushed away,negative,0.9679393172264099,sadness,0.914556622505188,non_irony,0.7801712155342102
I hate having social anxiety lmao,hate social anxiety lmao,negative,0.9253430962562561,sadness,0.849238932132721,non_irony,0.6073220372200012
"Social anxiety sucks.

“I can’t go to that thing tonight because I can’t be around people right now.”

“Oh god my friend hates me cause I didn’t go to their thing tonight because I couldn’t be around them even tho I don’t hate them. But they def hate me.”

FUCKing can’t win.",social anxiety sucks go thing tonight around people right oh god friend hates cause didn go thing tonight around even tho hate def hate fucking win,negative,0.9804055094718933,anger,0.877975583076477,non_irony,0.6481916904449463
"I know you are shy and awkward, but saying ""Hi"" in person is also good. I also have social anxiety, but I hate it when they get so indirect like when they tell me they miss me, but never said it in person",know shy awkward saying hi person also good also social anxiety hate get indirect like tell miss never said person,neutral,0.4520644545555115,sadness,0.9087342023849487,irony,0.5285689234733582
It is true about internet friends if you meet them they hate you and then tell other people what you are like in real life. This is where my social anxiety starts,true internet friends meet hate tell people like real life social anxiety starts,negative,0.8533833026885986,sadness,0.6242390871047974,irony,0.9222778081893921
"@GreyDeLisle I have social anxiety, and I truly HATE bothering people.  I HATE interacting with most honestly.  I am polite though, and sometimes have a question, or an issue.  I’m sure you never thought about it this way, but believe me, there are people who HATE to bother you. #AnxietyLife",social anxiety truly hate bothering people hate interacting honestly polite though sometimes question issue sure never thought way believe people hate bother #anxietylife,negative,0.9144927263259888,sadness,0.7437453866004944,non_irony,0.7927533388137817
i hate having social anxiety so much !!!!!!!!! it sabotages me all the time !!!!!!!!! twitter.com/heslittlemuse/…,hate social anxiety much sabotages time,negative,0.9695660471916199,sadness,0.9264945387840271,irony,0.5128100514411926
I will never forgive myself for not getting that flight attendants Snapchat or ANYTHING on my flight to Vegas. He was so fine 😭 Social anxiety was acting up &amp; I was scared lmaooooo I hate it here sos,never forgive not getting flight attendants snapchat anything flight vegas fine social anxiety acting amp scared lmaooooo hate sos,negative,0.9413245916366577,anger,0.9766985774040222,non_irony,0.5441685318946838
"I start this new job tomorrow, and I hate the nerves that come with it. Like, it's not even anxiety about me performing well, it's all social based shit. 🙄",start new job tomorrow hate nerves come like not even anxiety performing well social based shit,negative,0.9628241658210754,anger,0.5390943884849548,irony,0.6104748249053955
"a thing i hate: telling peole who have  social anxiety to 'stop being self centered nobody care about what youre doing' 

its not helpful At All and just makes it worse!!! 🙃",thing hate telling peole social anxiety stop self centered nobody care youre not helpful makes worse,negative,0.9786635637283325,anger,0.6205836534500122,irony,0.6873713135719299
"You don’t get tell a person dealing with anxiety, social or otherwise, what triggers that anxiety. For instance I deal with social anxiety, and I hate being forced to speak in front of people.

At the same time I love speaking in front of people about my passions",get tell person dealing anxiety social otherwise triggers anxiety instance deal social anxiety hate forced speak front people time love speaking front people passions,negative,0.5558302402496338,sadness,0.8963407874107361,irony,0.6675175428390503
I always get anxious when going to work. My anxiety and  social phobia acting up everytime. I get stomach aches and I fell like throwing up. I hate it..you wouldn't think I have anxiety when you talk to me on here but in rl I'm a shy little potatoes that just wants to stay in bed,always get anxious going work anxiety social phobia acting everytime get stomach aches fell like throwing hate think anxiety talk rl shy little potatoes wants stay bed,negative,0.9399687051773071,sadness,0.9570425748825073,non_irony,0.6769733428955078
i hate having social anxiety lollllll,hate social anxiety lollllll,negative,0.9402172565460205,sadness,0.9217273592948914,non_irony,0.5370021462440491
Been struggling with social anxiety for a while now and I hate that the only way to “get better” is to just go out and be social....I’m stressed.,struggling social anxiety hate way get better go social stressed,negative,0.6738840937614441,sadness,0.9717339873313904,non_irony,0.5108556747436523
"@melissavajskop Social anxiety is being in a room full of people verbally telling you they hate you, and you feel like they hate you. Shit. Nvm. That’s just me",social anxiety room full people verbally telling hate feel like hate shit nvm,negative,0.9562509059906006,anger,0.9182862639427185,irony,0.7108226418495178
@cuhhlett He got social anxiety like summer walker now¿!💀 you hate to see it,got social anxiety like summer walker hate see,negative,0.9339426159858704,sadness,0.6883020401000977,non_irony,0.7002559304237366
Man lmao I fucking hate social anxiety,man lmao fucking hate social anxiety,negative,0.9696268439292908,anger,0.9409644603729248,non_irony,0.5774564146995544
"The grinch going to the house party and saying they’re all gonna hate me,  and finally rings the door bell and says I did it is a freaking mood. love having social anxiety.",grinch going house party saying gonna hate finally rings door bell says freaking mood love social anxiety,negative,0.514934778213501,anger,0.6225964426994324,irony,0.9348729252815247
I hate having social anxiety,hate social anxiety,negative,0.9546524286270142,sadness,0.8515599966049194,irony,0.712561845779419
Social Anxiety is crazy and I hate it! I can't even enjoy dinner with a friend cause im mentally trippen and thinking the worst thoughts ever.,social anxiety crazy hate even enjoy dinner friend cause im mentally trippen thinking worst thoughts ever,negative,0.9792832732200623,sadness,0.8755987882614136,non_irony,0.8603866100311279
"dealing with my social anxiety is difficult when i don't even understand why im so scared to talk to people, my brain just refuses to let me for some reason and i hate that",dealing social anxiety difficult even understand im scared talk people brain refuses let reason hate,negative,0.9381556510925293,sadness,0.7254716157913208,non_irony,0.8485599756240845
It’s not even about me being lazy which I mean don’t get me wrong..... I am lol BUT my social anxiety is absolutely ridiculous &amp; I really just hate going in anywhere lol,not even lazy mean get wrong lol social anxiety absolutely ridiculous amp really hate going anywhere lol,negative,0.9204953908920288,anger,0.543684720993042,non_irony,0.8917736411094666
"I honestly hate that I’m at the age where people I know are getting engaged, and married, and having kids. Like? I still live with my parents and ask my mom to talk to strangers for me when my social anxiety kicks in lmao",honestly hate age people know getting engaged married kids like still live parents ask mom talk strangers social anxiety kicks lmao,negative,0.9164236783981323,anger,0.9296152591705322,non_irony,0.5426931977272034
"social anxiety isn’t just “omg i hate this party.” 

it’s also:

— not wanting to wear clothes you want.

—on the verge of tears in public because you don’t want to be there.

— being physically, emotionally and mentally drained after anything.

don’t ever fake social anxiety.",social anxiety omg hate party also not wanting wear clothes want verge tears public want physically emotionally mentally drained anything ever fake social anxiety,negative,0.9696279764175415,sadness,0.9093529582023621,non_irony,0.6326532363891602
The more often I go out in public the worse my social anxiety gets. I hate being around anyone and it's super inconvenient when I have to actually do shit.,often go public worse social anxiety gets hate around anyone super inconvenient actually shit,negative,0.9747609496116638,sadness,0.5265288352966309,non_irony,0.5840890407562256
Can twt have a hate button trying to hurt ppls feelings w/o having my social anxieties hindering me,twt hate button trying hurt ppls feelings social anxieties hindering,negative,0.9360746145248413,anger,0.6737697124481201,non_irony,0.522181510925293
i hate having social anxiety. my brain be making all kinds of excuses so i won’t leave the house.,hate social anxiety brain making kinds excuses leave house,negative,0.9607958793640137,sadness,0.744563639163971,irony,0.601039707660675
Hate having social anxiety &amp;low confidence 😔,hate social anxiety amp low confidence,negative,0.962605893611908,sadness,0.9227069020271301,non_irony,0.5573394894599915
I hate when my social anxiety kicks in man.,hate social anxiety kicks man,negative,0.9597880244255066,sadness,0.6900086998939514,irony,0.6456042528152466
"@almahoffmann Thanks. Migraine combined w/social anxiety sucks. I hate wanting to go then backing out at last minute. I have my girls w/me, so add to it juggling them to the talk for my husband to pick up when he gets off work. The organizing overwhelming right now. :-(",thanks migraine combined social anxiety sucks hate wanting go backing last minute girls add juggling talk husband pick gets work organizing overwhelming right,negative,0.8818554282188416,sadness,0.50827556848526,irony,0.5079644918441772
I think I have social anxiety. Not that summer walker type. But I just hate having to be out in public and communicate with ppl. Honestly,think social anxiety not summer walker type hate public communicate ppl honestly,negative,0.9167698621749878,sadness,0.5027029514312744,non_irony,0.8068821430206299
What makes me hate my job is people telling me my attitude sucks when I’m actually happy. Do I complain? Yes. But most of the time is jokingly and I still get my job done. I know say stupid shit sometimes but I feel like I’m a decently nice person. I just have social anxiety 😭,makes hate job people telling attitude sucks actually happy complain yes time jokingly still get job done know say stupid shit sometimes feel like decently nice person social anxiety,negative,0.820713222026825,anger,0.886414647102356,irony,0.7966310977935791
Hate when I tell somebody about my social anxiety and they try to force me to be social 😒,hate tell somebody social anxiety try force social,negative,0.732097327709198,sadness,0.5671847462654114,irony,0.7349324822425842
"I hate it! Social anxiety drag me down.. SHIT SHIT SHIT! Matagal pa yun! Bat ko ba iniisip, yung expectations nila huh! I just wanna live in peace.",hate social anxiety drag shit shit shit matagal pa yun bat ko ba iniisip yung expectations nila huh wanna live peace,negative,0.9121764898300171,anger,0.6211381554603577,non_irony,0.7105029821395874
"#DuaLipa thinks social media is a breeding ground for hate &amp; #anxiety and urges people to be kinder to one another online. 

Read the @indepents full article here: ow.ly/n0tu50xgVXg",#dualipa thinks social media breeding ground hate amp #anxiety urges people kinder one another online read full article,negative,0.73012375831604,sadness,0.7796083688735962,non_irony,0.6073355674743652
@CoreyHirsch Depression and social anxiety. I can’t even go out to get groceries half the time hate that feeling of people looking /judging it’s crippling some days I always feel like I’m on stage speaking kind of fear,depression social anxiety even go get groceries half time hate feeling people looking judging crippling days always feel like stage speaking kind fear,negative,0.945614218711853,sadness,0.9552826881408691,non_irony,0.7112117409706116
6LACK Jumps To Summer Walker’s Defence Following Social Anxiety Hate infamousgeneration.com/2019/11/23/6la… https://t.co/XZlZCLMwXA,lack jumps summer walker defence following social anxiety hate,negative,0.7462148070335388,sadness,0.8595316410064697,irony,0.8692591786384583
full offense pero ang ganda ng speech ko pero i can't deliver it ??? my social anxiety won't let me deliver it properly i hate myself so much,full offense pero ang ganda ng speech ko pero deliver social anxiety let deliver properly hate much,negative,0.6952972412109375,anger,0.9036911725997925,non_irony,0.6544345021247864
I wish I didn’t fucking have social anxiety I hate parties,wish didn fucking social anxiety hate parties,negative,0.9604232907295227,anger,0.8130485415458679,irony,0.7901172041893005
does anyone else find it very difficult just introducing yourself? like I hate saying my name and always feel extremely awkward initiating a handshake. just thinking about my social anxiety out loud here at 1am on friday night,anyone else find difficult introducing like hate saying name always feel extremely awkward initiating handshake thinking social anxiety loud friday night,negative,0.895555317401886,sadness,0.7928358316421509,non_irony,0.7784855961799622
"I hate anxiety especially my social anxiety. I feel riddled full of anxiety. 
And depressive episodes suck too.
So hard to fall asleep but then also hard to wake up.",hate anxiety especially social anxiety feel riddled full anxiety depressive episodes suck hard fall asleep also hard wake,negative,0.9700842499732971,sadness,0.961692214012146,non_irony,0.7939260005950928
"6LACK Jumps To Summer Walker's Defence Following Social Anxiety Hate
hiplifehiphop.com/6lack-jumps-to…",lack jumps summer walker defence following social anxiety hate,negative,0.7462148070335388,sadness,0.8595316410064697,irony,0.8692591786384583
"6LACK Jumps To Summer Walker's Defence Following Social Anxiety Hate
hiplifehiphop.com/6lack-jumps-to…",lack jumps summer walker defence following social anxiety hate,negative,0.7462148070335388,sadness,0.8595316410064697,irony,0.8692591786384583
6LACK Jumps To Summer Walker's Defence Following Social Anxiety Hate - hiplifehiphop.com/6lack-jumps-to…,lack jumps summer walker defence following social anxiety hate,negative,0.7462148070335388,sadness,0.8595316410064697,irony,0.8692591786384583
Mfs who hate on Summer Walker when she tries to explain how social anxiety works : twitter.com/loremricksum/s…,mfs hate summer walker tries explain social anxiety works,negative,0.8834795951843262,anger,0.8135668039321899,irony,0.933445155620575
Want to make friends but then social anxiety is like ‘no they hate you’,want make friends social anxiety like no hate,neutral,0.6046633720397949,anger,0.5641111135482788,non_irony,0.6454746127128601
"I hate crowds esp when they are so close to you . It makes me feel so uncomfortable , i feel like i can't breath , im scared as well .. is it a sign of social anxiety disorder ? im confused",hate crowds esp close makes feel uncomfortable feel like breath im scared well sign social anxiety disorder im confused,negative,0.974518358707428,sadness,0.9212188124656677,non_irony,0.8809497952461243
I wanna cry I hate being a cashier and being pressured to get people to sign up for credit cards like I really can’t handle rejection and on top of that I have so much social anxiety lmaoo,wanna cry hate cashier pressured get people sign credit cards like really handle rejection top much social anxiety lmaoo,negative,0.9471282362937927,sadness,0.747092068195343,non_irony,0.7449575662612915
Why is not emotional eating one of the hardest things ever 😭 I hate social anxiety ugh,not emotional eating one hardest things ever hate social anxiety ugh,negative,0.976068377494812,sadness,0.8318402171134949,non_irony,0.5492029190063477
You don't understand. I'm not so vain that I probably think the song is about me. The song is about me because I have social anxiety and you probably hate me.,understand not vain probably think song song social anxiety probably hate,negative,0.7481692433357239,sadness,0.8811820149421692,non_irony,0.8005760312080383
