renderedContent,pre_processed,label_sentiment,probability_sentiment,label_emotion,probability_emotion,label_irony,probability_irony
"true story: I’m majoring in communications but I just really hate social media at times because of the anxiety and stress I face whenever I’m on the apps. the comparison between one another scares me &amp; the things I’ve experienced here before, I hope no one goes through it (“:",true story majoring communications really hate social media times anxiety stress face whenever apps comparison one another scares amp things experienced hope no one goes,negative,0.9387248158454895,sadness,0.9582378268241882,non_irony,0.5728054046630859
I've never had THIS level of social anxiety I hate my mind,never level social anxiety hate mind,negative,0.963406503200531,anger,0.486787885427475,non_irony,0.6591084599494934
“I have social anxiety” is also me saying “I hate people.”,social anxiety also saying hate people,negative,0.9497023820877075,anger,0.8256741762161255,irony,0.8346630930900574
6LACK Jumps To Summer Walker's Defence Following #SocialAnxiety Hate buff.ly/33eMQUn by @chantillypost via @HotNewHipHop https://t.co/eCgpZAfAUt,lack jumps summer walker defence following #socialanxiety hate via,negative,0.693988025188446,sadness,0.8218408823013306,irony,0.898779034614563
"Ya ampun kalo gue gak ada social anxiety gue udah nyari magang sama kerja sana sini dengan mudah kali tanpa harus takut hal ini itu

Ahhhhhhhhhhh fck I hate myself for having social anxiety",ya ampun kalo gue gak ada social anxiety gue udah nyari magang sama kerja sana sini dengan mudah kali tanpa harus takut hal ini itu ahhhhhhhhhhh fck hate social anxiety,negative,0.9472476840019226,anger,0.8062861561775208,non_irony,0.7124252319335938
"Having social anxiety while being extroverted is weird. Yes I have talked to all the people, but I also think they all hate me and want me to go away. https://t.co/uzQAeL4s5O",social anxiety extroverted weird yes talked people also think hate want go away,negative,0.7715988755226135,sadness,0.792237401008606,irony,0.7633315324783325
"Social Anxiety:
1) Oh boy! [Event] looks like fun! I should go! There are cool people there!
2) Oh God. There are COOL PEOPLE there. Cool People *hate* me. AHHHH!
3) Okay. Let's be rational. What happens at [Event]? Talks by international speakers! And my peers are there! Yaaaay!",social anxiety oh boy event looks like fun go cool people oh god cool people cool people hate ahhhh okay let rational happens event talks international speakers peers yaaaay,positive,0.8953428864479065,joy,0.9377032518386841,irony,0.9315700531005859
I hate how people be coming for summer walker like having social anxiety isn’t real sht is weird &amp; yall wonder why people don’t open up &amp; be themselves now,hate people coming summer walker like social anxiety real sht weird amp yall wonder people open amp,negative,0.9477546215057373,anger,0.9078406691551208,non_irony,0.5845046043395996
I HATE NOT BEING ABLE TO DRIVE &amp; HAVING SOCIAL ANXIETY.,hate not able drive amp social anxiety,negative,0.9562408924102783,sadness,0.8312594890594482,irony,0.5730663537979126
I wanna try and be more social with my twitch friends and even in public but I genuinely hate having anxiety and just being plane old shy lmao,wanna try social twitch friends even public genuinely hate anxiety plane old shy lmao,negative,0.7693560123443604,sadness,0.9244978427886963,non_irony,0.9232154488563538
my anxiety gets the best of me. i dont think im a leech or a social climber or anything but my brain keeps insisting that i am and i hate that. i just like making friends n connecting with ppl i think are genuinely cool,anxiety gets best dont think im leech social climber anything brain keeps insisting hate like making friends connecting ppl think genuinely cool,neutral,0.44135186076164246,sadness,0.9272724390029907,non_irony,0.55901700258255
i got a new excuse...i got social anxiety...dont hate me,got new excuse got social anxiety dont hate,neutral,0.4902009665966034,sadness,0.558394730091095,irony,0.5677153468132019
@Mandoline79 I understand social anxiety. Even happens with me at extended family get togethers. I hate small talk. I like to hide in the corner just to say I showed up then leave early. But sometimes getting out ends up feeling good. But you do you. Don’t feel pressured. You can rock this.,understand social anxiety even happens extended family get togethers hate small talk like hide corner say showed leave early sometimes getting ends feeling good feel pressured rock,negative,0.6330940127372742,sadness,0.9096187949180603,non_irony,0.7222386598587036
i hate that i have social anxiety 😭,hate social anxiety,negative,0.9546524286270142,sadness,0.8515599966049194,irony,0.712561845779419
"the social anxiety got the better of me this time lads, now i hate leaving the house✌🏻",social anxiety got better time lads hate leaving house,negative,0.6827617287635803,sadness,0.7252191305160522,irony,0.7249698638916016
I was also literally getting an anxiety attack cause like I hate social interaction where it's obvious I'm not interested and I'm trying to do my business of looking for books and this guy is up my ass asking about WoW and won't leave glad my mom was with me....,also literally getting anxiety attack cause like hate social interaction obvious not interested trying business looking books guy ass asking wow leave glad mom,negative,0.9787212014198303,anger,0.6589324474334717,non_irony,0.5465579628944397
"I hate having social anxiety, it’s always fucking me up😭💔",hate social anxiety always fucking,negative,0.9813744425773621,anger,0.8721240162849426,irony,0.6109116673469543
"Hate the tories? Scared for the future? Dunno how to relieve some of that collective anxiety? 
GET INVOLVED TODAY! 🌹

Events in every borough- canvassing, leafleting, fundraisers. 
OR donate online to the @UKLabour 
OR use social media to spread the word

events.labour.org.uk",hate tories scared future dunno relieve collective anxiety get involved today events every borough canvassing leafleting fundraisers donate online use social media spread word events labour org uk,negative,0.4968331754207611,optimism,0.3914615213871002,irony,0.5261126756668091
If I won‘t meet Natasha today bc of social anxiety I will hate me forever.. Why can’t I just walk in there and act like a normal human being?!,meet natasha today bc social anxiety hate forever walk act like normal human,negative,0.6688783168792725,sadness,0.8584590554237366,non_irony,0.5553141832351685
The evening with my family some days ago made my social anxiety so much worse and I hate them for doing that,evening family days ago made social anxiety much worse hate,negative,0.9728302359580994,sadness,0.8869410753250122,irony,0.8010047078132629
anxiety afterwards is why i hate going and being social,anxiety afterwards hate going social,negative,0.9371639490127563,sadness,0.9269910454750061,non_irony,0.6061935424804688
sleepover buddy's bringing a plus one; social anxiety stepped up a notch. i hate people.,sleepover buddy bringing plus one social anxiety stepped notch hate people,negative,0.9656541347503662,anger,0.553353488445282,irony,0.5030239224433899
"@IivingdeadgirIs Goth girls are going for normies now cause it’s not only autistic wanna be edgy introvert , social anxiety , everything fun is cringy mindset people they can get. Your time is over my guy. Step aside let the alphas in. Nothing personal kiddo, don’t hate the player hate the game x",goth girls going normies cause not autistic wanna edgy introvert social anxiety everything fun cringy mindset people get time guy step aside let alphas nothing personal kiddo hate player hate game,negative,0.5695141553878784,anger,0.8130471706390381,irony,0.5557559728622437
All my friends going to these music festivals but my social anxiety ass fucking hate that shit so who tryna go for boba tea and sushi and talk about how unhappy we are in life hmu🥰,friends going music festivals social anxiety ass fucking hate shit tryna go boba tea sushi talk unhappy life hmu,negative,0.9634152054786682,anger,0.882025957107544,non_irony,0.7816952466964722
"@GarethFoy I always want to go sit in a coffee shop or book store and just work on my book but can never get myself to go. I hate doing things alone because of my depression and social anxiety and usually end up talking myself out of it lol 
I get the most done from 9pm-4am most days.",always want go sit coffee shop book store work book never get go hate things alone depression social anxiety usually end talking lol get done pm days,negative,0.6226990818977356,sadness,0.9715099930763245,non_irony,0.807712733745575
Well its confirmed. I still hate going to weddings alone. Just a bunch of anxiety triggers and social torment,well confirmed still hate going weddings alone bunch anxiety triggers social torment,negative,0.9537560939788818,sadness,0.9236751794815063,non_irony,0.5838891267776489
bro i hate having like mild social anxiety.,bro hate like mild social anxiety,negative,0.957226037979126,sadness,0.5707011222839355,irony,0.8216026425361633
"(Cleaning out drafts)
I hate not having my social anxiety as a crutch bc without it i lose all boundaries and get annoying and loud and talkative 💦",cleaning drafts hate not social anxiety crutch bc without lose boundaries get annoying loud talkative,negative,0.9097710847854614,anger,0.808121383190155,non_irony,0.6307296752929688
Fkkkk i hate it when my mom wants me to call customer service to complain. I HAVE SOCIAL ANXIETY!!!,fkkkk hate mom wants call customer service complain social anxiety,negative,0.963685154914856,anger,0.9627022743225098,irony,0.6536174416542053
"by hate like this, even playing Football as an openly Gay/Bi male I never directly faced any targeted discrimination. I still have a lot of social anxiety and potential BPD just thinking of this happening so openly in even a part of the smash community is terrifying and sickening",hate like even playing football openly gay bi male never directly faced targeted discrimination still lot social anxiety potential bpd thinking happening openly even part smash community terrifying sickening,negative,0.9548496007919312,anger,0.8844507932662964,non_irony,0.6365430355072021
Trying to make friends and having crippling social anxiety is an Olympic sport and I hahahatemyself every time I convince myself they’ll hate me so I’m better off isolating again,trying make friends crippling social anxiety olympic sport hahahatemyself every time convince hate better isolating,negative,0.9026098251342773,sadness,0.9512376189231873,irony,0.8399209976196289
I hate being in social settings where anxiety combined with a low social meter makes me seem stand off-ish 😬so sorry,hate social settings anxiety combined low social meter makes seem stand ish sorry,negative,0.9466184377670288,sadness,0.8500074744224548,irony,0.5422912240028381
hi social anxiety how are ya I was doing great but not anymore thanks i hate it,hi social anxiety ya great not anymore thanks hate,negative,0.7612380385398865,sadness,0.5953993201255798,irony,0.9248608350753784
@RMs_Jams I hope someday we both can overcome our social anxiety. 💜💜Btw don't hate yourself or else KING SEOKJIN will throw a flying pan at you😂💜💜,hope someday overcome social anxiety btw hate else king seokjin throw flying pan,positive,0.5139580965042114,joy,0.6110091209411621,non_irony,0.7275292873382568
I FUCXKING HATE SOCIAL ANXIETY SO MUCH,fucxking hate social anxiety much,negative,0.9802075624465942,anger,0.8806955814361572,non_irony,0.6030856966972351
"If I avoid you it doesn’t mean I hate you,  it just means that I have severe social anxiety and it’s a ten step process just to say hi",avoid doesn mean hate means severe social anxiety ten step process say hi,negative,0.5627439618110657,sadness,0.5206283926963806,irony,0.5458182692527771
"I tried to go to a party the other night, but my social anxiety won. I hate disappointing people and turning down invites as so few come my way. I hope people understand. #anxiety #illbeok #imtrying",tried go party night social anxiety hate disappointing people turning invites come way hope people understand #anxiety #illbeok #imtrying,negative,0.5952736735343933,sadness,0.9164549708366394,non_irony,0.7604168653488159
"I hate my social anxiety, I'm too scared to hug a suiter",hate social anxiety scared hug suiter,negative,0.9441956281661987,sadness,0.9580877423286438,non_irony,0.6672461628913879
I hate when my social anxiety comes out to play bro,hate social anxiety comes play bro,negative,0.9138147234916687,sadness,0.6554281711578369,non_irony,0.6774671673774719
"Hate being around new people , especially if we not vibing , social anxiety be kicking in and I be quiet 🥴😭",hate around new people especially not vibing social anxiety kicking quiet,negative,0.906533420085907,sadness,0.7742668986320496,non_irony,0.7079102993011475
"ugh, i hate coming to my daughters school events. first of all, i have social anxiety. second of all, i always feel so judged by the other parents. third of all, her principle always gives me a look of disgust and i’m about to snap on his ass any minute.",ugh hate coming daughters school events first social anxiety second always feel judged parents third principle always gives look disgust snap ass minute,negative,0.9801003336906433,anger,0.9704598784446716,irony,0.6573017835617065
"Also a social worker from my school came by my house to check on me and I almost had a panic attack because my anxiety got so bad just from talking to her so I already know I'm gonna freak out at school on Monday, I hate anxiety :(",also social worker school came house check almost panic attack anxiety got bad talking already know gonna freak school monday hate anxiety,negative,0.9434276223182678,sadness,0.896263837814331,irony,0.5059233903884888
Absolutely hate social anxiety. Like I hate me and because of this brain boi thinks everyone hates me too and I hate that https://t.co/IwUiaVfy8n,absolutely hate social anxiety like hate brain boi thinks everyone hates hate,negative,0.9797412157058716,anger,0.8561128377914429,irony,0.7695059776306152
I seriously hate having social anxiety. I have to go to the store but I’m too terrified to go by myself but nobody else wants to go with me.,seriously hate social anxiety go store terrified go nobody else wants go,negative,0.9725134372711182,sadness,0.863540530204773,non_irony,0.8533545136451721
@loriirosetv My weight. I have PCOS and am very active but my weight never changes... I feel like I'm always judged for being fat. It has made my social anxiety cause me to hate leaving my house... streaming has helped that a lot,weight pcos active weight never changes feel like always judged fat made social anxiety cause hate leaving house streaming helped lot,negative,0.8381778001785278,sadness,0.9646133780479431,non_irony,0.5432637929916382
The pressure of social media in the 21st century is immense and I'm not surprised that people struggle and have anxiety cause as soon as you make a mistake you are cancelled and people hate on you and start to pull up things from years ago to put even more pressure onto people...,pressure social media st century immense not surprised people struggle anxiety cause soon make mistake cancelled people hate start pull things years ago put even pressure onto people,negative,0.8724563717842102,sadness,0.6386546492576599,irony,0.5267502665519714
met greta n my friend was chatting away with her. she turned to me n i froze instead of telling her how much i’ve been in awe of her i asked her for a selfie and she was sooo sweet but i was so nervous i took the worst pic ever. my heart still hurts i hate social anxiety so much twitter.com/gerwigupdates/…,met greta friend chatting away turned froze instead telling much awe asked selfie sooo sweet nervous took worst pic ever heart still hurts hate social anxiety much,negative,0.9100886583328247,sadness,0.9577382802963257,non_irony,0.8204050064086914
@bloopkitty I hate the holidays cuz my anxiety and depression are at their worst at this time so I’m trying to stay away from my triggers like social media etc.,hate holidays cuz anxiety depression worst time trying stay away triggers like social media etc,negative,0.947856068611145,sadness,0.9575611352920532,irony,0.7737631797790527
I hate being in Miami so much fr 💯 nowhere near as much as I hated my hometown but at least there I didn't face crippling social anxiety,hate miami much fr nowhere near much hated hometown least didn face crippling social anxiety,negative,0.9527551531791687,sadness,0.6802963614463806,non_irony,0.8315384984016418
I hate that in certain situations I have the WORST social anxiety 🙃,hate certain situations worst social anxiety,negative,0.9654389023780823,sadness,0.6785033941268921,non_irony,0.6281425952911377
"i was supposed go to my friends birthday party but my social anxiety is so bad rn and im just afraid of people so im not able to go there :( i hate this, i cant go anywhere",supposed go friends birthday party social anxiety bad rn im afraid people im not able go hate cant go anywhere,negative,0.946706235408783,sadness,0.966339111328125,non_irony,0.9281258583068848
tired from today's game of do they hate me or is it social anxiety,tired today game hate social anxiety,negative,0.9631343483924866,sadness,0.9577977061271667,irony,0.6158266663551331
"People over 40: Goddamn it, another robocall, I hate these!

Everyone else: Thank God it's not another human being, my social anxiety was fucking me up",people goddamn another robocall hate everyone else thank god not another human social anxiety fucking,negative,0.9776833653450012,anger,0.9814727306365967,irony,0.7702525854110718
Social anxiety should not be a thing because I hate it,social anxiety not thing hate,negative,0.7079208493232727,anger,0.6119946241378784,non_irony,0.6928451061248779
Gotta love having a panic attack prior to a presentation. I hate talking in front of people. My anxiety is through the roof. #FridayThoughts #socialanxiety,gotta love panic attack prior presentation hate talking front people anxiety roof #fridaythoughts #socialanxiety,negative,0.44721829891204834,sadness,0.9347059726715088,irony,0.6643459796905518
"also here is the thing.

you think asking people to move a bag causes social anxiety.

I hate when strangers sit next to me

that causes me to have social anxiety

If there is a spare seat and you are asking to sit next to me specifically. That will make my anxiety skyrocket",also thing think asking people move bag causes social anxiety hate strangers sit next causes social anxiety spare seat asking sit next specifically make anxiety skyrocket,negative,0.9088447093963623,sadness,0.4921003580093384,irony,0.5709191560745239
"God, I hate so much being the one to always start conversations, so an extra special kudos to the people who go out of their way to do this with me. Y'all are MVPs, giving my social anxiety a little less to fret over. &lt;3 I hope I can return the favour sometimes.",god hate much one always start conversations extra special kudos people go way mvps giving social anxiety little less fret lt hope return favour sometimes,negative,0.7050334215164185,anger,0.5812757015228271,non_irony,0.728257954120636
ngl its so fucking hard to deal with social anxiety. whenever i got anxiety attacks on public it feels like a trauma to me. its so embarrassing and people dont even know what was happening to me. they just think that im a crybaby or smth. i really hate being center of attention,ngl fucking hard deal social anxiety whenever got anxiety attacks public feels like trauma embarrassing people dont even know happening think im crybaby smth really hate center attention,negative,0.979958713054657,anger,0.5054877996444702,non_irony,0.6941934823989868
"Lrt that was what i feel when my friends asking me out but nah.......
And ended up i hate myself for being social anxiety",lrt feel friends asking nah ended hate social anxiety,negative,0.7747806906700134,sadness,0.8310914635658264,non_irony,0.5885818600654602
"#AnxietyFeelsLike sa mga di nakakaalam, meron akong social anxiety and agoraphobia. Wala akong kayang puntahan na lugar na mag isa lang, and I hate malls!! I also hate crowded places. 😭",#anxietyfeelslike sa mga di nakakaalam meron akong social anxiety agoraphobia wala akong kayang puntahan na lugar na mag isa lang hate malls also hate crowded places,negative,0.862437903881073,sadness,0.9314795732498169,non_irony,0.8700025677680969
I have social anxiety and I hate y’all for this twitter.com/BaileighRobins…,social anxiety hate,negative,0.9658153057098389,anger,0.4871639311313629,irony,0.6400758624076843
I hate how my social anxiety ruins everything for me. I get presented opportunities on a silver platter and there's a mental wall that prevents me from capitalizing.,hate social anxiety ruins everything get presented opportunities silver platter mental wall prevents capitalizing,negative,0.924405038356781,sadness,0.7670133113861084,irony,0.5408512353897095
My social anxiety is so bad I hate when I get around mfs &amp; get shy 😐,social anxiety bad hate get around mfs amp get shy,negative,0.9464415311813354,sadness,0.8057966828346252,non_irony,0.7544880509376526
I hate periods yo. They really exacerbate my social anxiety,hate periods yo really exacerbate social anxiety,negative,0.9691195487976074,sadness,0.8341686129570007,irony,0.9119442105293274
I fucking hate social anxiety. Panic attacks are the bane of my existence.,fucking hate social anxiety panic attacks bane existence,negative,0.9813446998596191,anger,0.8809906244277954,non_irony,0.6254701018333435
@DeadlyImageASMR Yeah. Busy or not they should let an employee use the restroom. Thank god one of the assistants let me go. Like...I hate how they treat their employees. This is why I get social anxiety. 😞,yeah busy not let employee use restroom thank god one assistants let go like hate treat employees get social anxiety,negative,0.657680332660675,anger,0.686643660068512,irony,0.9358136653900146
I really hate social anxiety. Went to get my oil changed at Walmart and to get some things for the family. Sat in my car for 40 minutes and no one came to help and couldn’t leave my car to go ask someone what the heck is going on.,really hate social anxiety went get oil changed walmart get things family sat car minutes no one came help leave car go ask someone heck going,negative,0.930360734462738,sadness,0.495106965303421,non_irony,0.8984084129333496
I hate having anxiety especially with a personality like mine. I’m so out going &amp; social. I honestly feel like I flopped this interview because I fukin froze up &amp; didn’t give my best answers 😒,hate anxiety especially personality like mine going amp social honestly feel like flopped interview fukin froze amp didn give best answers,negative,0.9716103076934814,sadness,0.8116759061813354,non_irony,0.8890450596809387
my social anxiety really be hitting me when i’m on drive thru i hate this,social anxiety really hitting drive thru hate,negative,0.9581034779548645,anger,0.7591127753257751,irony,0.6903884410858154
"@many_oneof Just being polite saying sorry.
Or is it just a hook?
You'll loose that uncomfortable feel once evil has abused you enough. Honestly I never had so much distrust and hate in me till I TRUSTED VA for help Mental health therapy for social anxiety. 
I fault myself.",polite saying sorry hook loose uncomfortable feel evil abused enough honestly never much distrust hate till trusted va help mental health therapy social anxiety fault,negative,0.8304489850997925,sadness,0.867863118648529,non_irony,0.7682079076766968
"@SoVeryBritish I wonder what % of Brits suffer social anxiety compared to other countries. I suffer it, I hate it.",wonder brits suffer social anxiety compared countries suffer hate,negative,0.8905637860298157,sadness,0.7037093639373779,irony,0.8423067927360535
"hätte eigentlich 14 punkte in englisch, da meine social anxiety aber so extrem ist, dass ich vor lauter angst nicht vor der klasse vorstellen wollte, habe ich jetzt nur 7

i hate myself 😙✌🏻",tte eigentlich punkte englisch da meine social anxiety aber extrem ist dass ich vor lauter angst nicht vor der klasse vorstellen wollte habe ich jetzt nur hate,negative,0.526401162147522,anger,0.6211920380592346,non_irony,0.8206610679626465
"@sushimonojoonie Ask them if the realize that it was a hate twt and if they do not respond or they say they do then I personally would just block them.
If you don’t want to ask (that is valid, I don’t always for social anxiety reasons) I would just block. No negativity on the tl if possible.",ask realize hate twt not respond say personally would block want ask valid always social anxiety reasons would block no negativity tl possible,negative,0.6922499537467957,anger,0.8528947234153748,non_irony,0.8891074657440186
"@AnveEloum @fromsarahlex As someone with social anxiety and agoraphobia I hate when I have to get the door. I appreciate them dropping it off and leaving. It's different though with regular post, who often leave fake attempted delivery slips which I imagine OP was talking about.",someone social anxiety agoraphobia hate get door appreciate dropping leaving different though regular post often leave fake attempted delivery slips imagine op talking,negative,0.819331169128418,anger,0.5375648736953735,non_irony,0.5432199239730835
I hate how bad my social anxiety is,hate bad social anxiety,negative,0.9634106159210205,sadness,0.8969192504882812,irony,0.6551653146743774
