renderedContent,pre_processed,label_sentiment,probability_sentiment,label_emotion,probability_emotion,label_irony,probability_irony
I swear I only have social anxiety when it comes to phone calls. I hate them. And I don't know why.,swear social anxiety comes phone calls hate know,negative,0.9451118111610413,sadness,0.5088921785354614,irony,0.8851594924926758
@kateraed_ Same! I also went Christmas shopping today. I hate going this late. It was horrible on my social anxiety 😭,also went christmas shopping today hate going late horrible social anxiety,negative,0.9302273988723755,sadness,0.8723088502883911,irony,0.7441051006317139
I want to make a documentary called “The secret life of popular furries”.. except it would just wind up being a short film of people suffering from heat exhaustion and extreme social anxiety while they read through all the hate mail and death threats they get on social media.,want make documentary called secret life popular furries except would wind short film people suffering heat exhaustion extreme social anxiety read hate mail death threats get social media,negative,0.852632462978363,sadness,0.8086361885070801,irony,0.8963666558265686
"@ChambieZA Ive been dabbling in it. Showing my face more often. Its terrifying when you suffer from social anxiety, I still hate it. Tinder is even fucken worse than Insta though. 😅",ive dabbling showing face often terrifying suffer social anxiety still hate tinder even fucken worse insta though,negative,0.9794656038284302,sadness,0.5466011762619019,non_irony,0.7626934051513672
"I hate dressing up and being fake and being judged and feeling absolutely crippled with social anxiety, god I absolutely despise this process",hate dressing fake judged feeling absolutely crippled social anxiety god absolutely despise process,negative,0.9788411259651184,anger,0.7235130071640015,irony,0.505914032459259
"@PupGrimm I can relate so hard and i kinda hate it 

It fuels my social anxiety 😥",relate hard kinda hate fuels social anxiety,negative,0.8407307267189026,sadness,0.8983085751533508,non_irony,0.757023811340332
I hate working retail because of this right here.. my social anxiety is already bad as it is. Be nice people!! twitter.com/DrinkSolaPop/s…,hate working retail right social anxiety already bad nice people,negative,0.9569193720817566,anger,0.712565541267395,irony,0.670515775680542
Social media gives me anxiety. I hate checking dms. They just sit there until there’s an odd number and i feel obligated to check them,social media gives anxiety hate checking dms sit odd number feel obligated check,negative,0.9417569637298584,sadness,0.8167064785957336,non_irony,0.5788638591766357
"I hate myself. Every time I wanna go into the Ferdibert Discord chat to maybe make some online friends, I'm so overwhelmed by anxiety and the fear of rejection that I end up not doing anything. I've been abandoned by ""friends"" in the past so many times. My social skills are crap.",hate every time wanna go ferdibert discord chat maybe make online friends overwhelmed anxiety fear rejection end not anything abandoned friends past many times social skills crap,negative,0.9151527285575867,sadness,0.7735450863838196,non_irony,0.8526706695556641
I actually hate my social anxiety 🙄,actually hate social anxiety,negative,0.9723020195960999,sadness,0.6574472784996033,irony,0.7277660965919495
the thing I hate about social anxiety is it’s something you’re completely aware of and want to get rid of but you just cant without being your own worst enemy and mentally blocking yourself from doing so 😑,thing hate social anxiety something completely aware want get rid cant without worst enemy mentally blocking,negative,0.9320751428604126,sadness,0.8030570149421692,non_irony,0.8061641454696655
"- social anxiety 
- actual hate fire fruit
- decent execution at most games
-A seemingly bottomless hunger for ranked everything twitter.com/BodiedNovel/st…",social anxiety actual hate fire fruit decent execution games seemingly bottomless hunger ranked everything,negative,0.9595025181770325,anger,0.748081624507904,non_irony,0.6892530918121338
"Social Anxiety

I've been through many situations
That looked exactly as this
I tried to get along with some people
Whom exactly I just met
But hell this what I hate
To be in a crowd of people 
Whose eyes are... facebook.com/10000919126291…",social anxiety many situations looked exactly tried get along people exactly met hell hate crowd people whose eyes,negative,0.7235671877861023,sadness,0.4858369529247284,non_irony,0.7833033800125122
"I wish I could talk more but I have social anxiety and for me its even worse online;; I want to get better at it. I don't have many friends and sometimes  I feel lonely. But I don't  know what to do.
The friends I have I love them alot ♡
I just hate feeling anxious al the time",wish could talk social anxiety even worse online want get better many friends sometimes feel lonely know friends love alot hate feeling anxious al time,neutral,0.40678340196609497,sadness,0.9758922457695007,non_irony,0.8441752195358276
I hate when My sister tries to show me what’s morally right or wrong bro.  She’s probably one of the reasons why I have social anxiety because of it.,hate sister tries show morally right wrong bro probably one reasons social anxiety,negative,0.8503662347793579,sadness,0.6398640275001526,irony,0.6729859113693237
"I hate performing without a check cuz I have social anxiety, if I’m facing my fears I wanna get compensated for it. But New Years might be an exception",hate performing without check cuz social anxiety facing fears wanna get compensated new years might exception,negative,0.7858676314353943,sadness,0.8484417200088501,non_irony,0.6474462151527405
i used to be so loud and ratchet in public when i was younger now i got social anxiety like a mf . i hate even speaking 😂😂,used loud ratchet public younger got social anxiety like mf hate even speaking,negative,0.9748878479003906,anger,0.9535803198814392,irony,0.5195009708404541
"@TheLegendOfLeo @cgpgrey I'm confused, I assumed CGP Grey was a group/organization, what's ""a Tim,"" and what's wrong with someone wanting to make someone happy. I hate social interaction and have bad anxiety, but relish a great and engaging conversations. Just not good at starting them myself.",confused assumed cgp grey group organization tim wrong someone wanting make someone happy hate social interaction bad anxiety relish great engaging conversations not good starting,negative,0.7158368229866028,sadness,0.8181835412979126,non_irony,0.7988390326499939
"dude, i literally hate telling people i have any kind of social media lol 

why does anxiety make you scared of everything😭",dude literally hate telling people kind social media lol anxiety make scared everything,negative,0.9664455056190491,anger,0.7821539640426636,non_irony,0.5998480319976807
"i hate it. my mom makes me talk to strangers instead of her, as if my social anxiety is inexistant",hate mom makes talk strangers instead social anxiety inexistant,negative,0.9124855399131775,sadness,0.901577889919281,irony,0.6226702928543091
"And now I hate myself and am having social anxiety for the first time in like, two years. Joy.

Good job Lysander. 0 days without randomly ruining things for no reason.",hate social anxiety first time like two years joy good job lysander days without randomly ruining things no reason,negative,0.6796188950538635,sadness,0.7980104088783264,irony,0.9268279671669006
My social anxiety is off the charts right now I fucking hate my school for doing this good thing I have panic attack medication I can take before 🤩,social anxiety charts right fucking hate school good thing panic attack medication take,negative,0.9472151398658752,anger,0.5882720947265625,irony,0.9694984555244446
"Social anxiety is so so shitty. I hate it. I’ll spend hours debating with myself about whether I should or shouldn’t go out and eventually exhaust myself or make myself upset. It never gets easier. A lot of times I have great fun, but it’s so difficult to get myself confident.",social anxiety shitty hate spend hours debating whether go eventually exhaust make upset never gets easier lot times great fun difficult get confident,negative,0.6639428734779358,sadness,0.8770987391471863,non_irony,0.6654004454612732
I hate that I hate when the Starbucks worker at the drive thru just leans out the window and makes conversation with me instead of just letting me sit in silence until my drink is ready....you’re so nice I’m so sorry I have such bad social anxiety hhhhhhhh,hate hate starbucks worker drive thru leans window makes conversation instead letting sit silence drink ready nice sorry bad social anxiety hhhhhhhh,negative,0.968217670917511,anger,0.9504319429397583,irony,0.716704249382019
"The grinch is just a person with social anxiety bottled up and hiding it with a facade of hate, pretending to be mean and look tough... the grinch is me.",grinch person social anxiety bottled hiding facade hate pretending mean look tough grinch,negative,0.6295306086540222,sadness,0.5900403261184692,irony,0.8457087278366089
STRIPPERS what are some tips you use to help with social anxiety while working? It’s starting to affect my money 🥴 and that’s a no no. If I drink I don’t have it but I hate being drunk at work,strippers tips use help social anxiety working starting affect money no no drink hate drunk work,neutral,0.5166577100753784,sadness,0.8708924651145935,irony,0.7413892149925232
also someone asked me for a coin today because he was unemployed and shit and my social anxiety made me give him 2€ knowing that i have only 3€ more when i could’ve given him less money because it was probably for drugs anyway i hate myself for being like this,also someone asked coin today unemployed shit social anxiety made give knowing could given less money probably drugs anyway hate like,negative,0.938360333442688,anger,0.6302833557128906,non_irony,0.7157102823257446
"You need to read your emotions. Understand your emotions. Being empathetic, self regulatory, motivated, social, self aware. 

What influences your actions: is it fear, anxiety, love, hate!!!",need read emotions understand emotions empathetic self regulatory motivated social self aware influences actions fear anxiety love hate,negative,0.6043684482574463,sadness,0.9198799729347229,non_irony,0.6843405365943909
"And we should understand when people who struggle with anxiety in social situations do these type of things, not create unnecessary hate twitter.com/BBCWorld/statu…",understand people struggle anxiety social situations type things not create unnecessary hate,negative,0.8017831444740295,anger,0.6665024757385254,non_irony,0.8305596113204956
I hate havein social anxiety,hate havein social anxiety,negative,0.9446092247962952,sadness,0.8266277313232422,irony,0.5977040529251099
Drinking coffee + seeing the guy you like be hot and popular with the boys on social media = anxiety and this is that time of night where I hate having feelings 🥺,drinking coffee seeing guy like hot popular boys social media anxiety time night hate feelings,negative,0.836013913154602,sadness,0.8316537737846375,irony,0.8797481656074524
"I’m playing Death Stranding on easy because BTs give me social strand anxiety

I’m also playing mainly for the delivery part not for the weird grey-scaled sea-life drama with a tone of red wrapping up sum blonde nonsense

Hate but don’t @ me

I’m kidding I stan https://t.co/1lWscrIAI5",playing death stranding easy bts give social strand anxiety also playing mainly delivery part not weird grey scaled sea life drama tone red wrapping sum blonde nonsense hate kidding stan,negative,0.7006381154060364,anger,0.8587243556976318,irony,0.6843715906143188
"Why I hate having social anxiety

-a thread",hate social anxiety thread,negative,0.931387186050415,sadness,0.8592959642410278,irony,0.6541746258735657
Another day I hate means one more day I love. Fucking social anxiety https://t.co/5tRndpx16v,another day hate means one day love fucking social anxiety,negative,0.9558476805686951,anger,0.7875597476959229,irony,0.9339291453361511
"Being anti-social is coo, no problems for the most part but my anxiety on 10 when it comes to meeting new people and I hate it 🙄",anti social coo no problems part anxiety comes meeting new people hate,negative,0.7130117416381836,sadness,0.6351563334465027,irony,0.6699625253677368
"I over compensate in social situations for the simple fact, I hate social situations because I’m filled with anxiety",compensate social situations simple fact hate social situations filled anxiety,negative,0.9227619171142578,sadness,0.6377614736557007,irony,0.5121001601219177
Y'all I went to see frozen 2 and this woman in front of me kept taking pictures with the flash on. Now I may have incredible social anxiety and hate conflict but after the 4th time I yelled at her,went see frozen woman front kept taking pictures flash may incredible social anxiety hate conflict th time yelled,negative,0.8457070589065552,anger,0.7979877591133118,non_irony,0.576204776763916
"The thing about social anxiety is that when you make a mistake, even if it's a minor one, in your mind it's like you activated a nuclear weapon and you ruined it and now you think people hate you. I hate that feeling...",thing social anxiety make mistake even minor one mind like activated nuclear weapon ruined think people hate hate feeling,negative,0.9365820288658142,anger,0.5824889540672302,non_irony,0.6550523042678833
@erifthefox Man I’d hate it if I felt that. I sometimes get social anxiety from my own reflection,man hate felt sometimes get social anxiety reflection,negative,0.8443694710731506,sadness,0.9355840086936951,non_irony,0.5843045115470886
"I hate having social anxiety, everytime I go out, I give myself an upset stomach because I'm so nervous",hate social anxiety everytime go give upset stomach nervous,negative,0.9683287143707275,sadness,0.8176133632659912,non_irony,0.5616365671157837
"one of the things I hate abt being down this time of year is that it intensely ups my social anxiety, like regression type shit. I don't need social isolation rn!!!",one things hate abt time year intensely ups social anxiety like regression type shit need social isolation rn,negative,0.9625060558319092,sadness,0.8576178550720215,non_irony,0.6743236184120178
@drjenlim @fitnursebee @ketaminh My Pager is my godsend .  My phone is either  constantly out of charge or out of range in the hospital. And I hate the phone anyway because my social anxiety throws me into a state every time it rings and I have to answer it.,pager godsend phone either constantly charge range hospital hate phone anyway social anxiety throws state every time rings answer,negative,0.8167724609375,sadness,0.7241523861885071,non_irony,0.8115265965461731
@ChansBScom You and me could relate. Hate when I have social anxiety and no one seems to care. Grateful to have friends here but it just like they faded away so quickly.,could relate hate social anxiety no one seems care grateful friends like faded away quickly,negative,0.9623057246208191,sadness,0.9452778697013855,non_irony,0.7893068790435791
i hate how my social anxiety is affecting my love life. like i could have had so many changes with some people but i’m just so anxious and too scared to say how i really feel,hate social anxiety affecting love life like could many changes people anxious scared say really feel,negative,0.8632574677467346,sadness,0.9625356793403625,non_irony,0.8137397766113281
@Wildbergerrrr I absolutely hate asking others to unlock stuff so you pick it out. Social Anxiety AHOY!,absolutely hate asking others unlock stuff pick social anxiety ahoy,negative,0.9461130499839783,anger,0.7629977464675903,irony,0.6678078174591064
"I mean, i like learning new things and staying with the people i know BUT i hate so fkn much all the anxiety that school gives to me. Nowadays we’re just a good or bad mark and all the stuff the teachers give to us... like we don’t have a social life or we don’t have to rest",mean like learning new things staying people know hate fkn much anxiety school gives nowadays good bad mark stuff teachers give us like social life rest,negative,0.6383103728294373,sadness,0.8461491465568542,irony,0.8113915920257568
"I really hate the concept of #TheUndateables. 

""Hey, let's take someone who struggles with self esteem and social anxiety and set them up on a date, hence making them more anxious....and follow it with a fucking camera crew...and MAKE IT LOOK LIKE WE'RE DOING THEM A FAVOUR!""",really hate concept #theundateables hey let take someone struggles self esteem social anxiety set date hence making anxious follow fucking camera crew make look like favour,negative,0.9642861485481262,anger,0.9468073844909668,irony,0.8756465911865234
"What's your level of social anxiety?
On a scale of 1 to ""looks up tweets/accounts for service industry complaints to observe what waiters/hairdressers/cashiers hate so I can try to be a less annoying customer""",level social anxiety scale looks tweets accounts service industry complaints observe waiters hairdressers cashiers hate try less annoying customer,negative,0.843102753162384,anger,0.8120128512382507,irony,0.8301345109939575
Social media ruins everything lmao. Peeping shit gives me anxiety then my mind wanders into a trap of depression. Yep i hate it here,social media ruins everything lmao peeping shit gives anxiety mind wanders trap depression yep hate,negative,0.9750159382820129,anger,0.4887031316757202,irony,0.5230151414871216
I love how Verizon has the ability for you to text a live representative at any moment and they will respond to you at any time for people who have social anxiety and hate to talk on the phone or ppl who hate talking for three hours to a representative that’s a robot👍🏼,love verizon ability text live representative moment respond time people social anxiety hate talk phone ppl hate talking three hours representative robot,positive,0.4205869138240814,sadness,0.4954434335231781,irony,0.7206516861915588
"@mashiikyu_ kptm ipoh je hehehehe,,, KAJSJAJAJ I HATE SOCIAL ANXIETY",kptm ipoh je hehehehe kajsjajaj hate social anxiety,negative,0.6991559863090515,sadness,0.856407880783081,non_irony,0.7185071110725403
okay yeah i made it and im trying to work up the nerve to enter a fucking a grocery store so i can buy myself some SNACKS 😫 my social anxiety came at the right time i hate it,okay yeah made im trying work nerve enter fucking grocery store buy snacks social anxiety came right time hate,negative,0.826129674911499,anger,0.8871819376945496,irony,0.7911964654922485
I hate having social anxiety :),hate social anxiety,negative,0.9546524286270142,sadness,0.8515599966049194,irony,0.712561845779419
update: i haven't replied yet. i hate public speaking and my social anxiety's got a firm grip on my non-existent balls right now (｡ŏ_ŏ) https://t.co/kvL878J95o,update replied yet hate public speaking social anxiety got firm grip non existent balls right,negative,0.825767993927002,anger,0.9191229939460754,irony,0.8653280138969421
i’m going on a date on wednesday and i have absolutely NO IDEA what the fuck imma do dude i hate social anxiety,going date wednesday absolutely no idea fuck imma dude hate social anxiety,negative,0.9713893532752991,sadness,0.5674499869346619,non_irony,0.9228932857513428
"So I’ve decided to feel the fear and do it anyway. I hate talking, especially in front of the camera, but I set myself a challenge and with my cat and fave music it wasn’t that scary #introvertproblems #socialanxiety twitter.com/AthenaWiseKitt…",decided feel fear anyway hate talking especially front camera set challenge cat fave music scary #introvertproblems #socialanxiety,negative,0.9456399083137512,sadness,0.9294158220291138,non_irony,0.8515975475311279
Umm ..had a social anxiety attack and called her and said I’m not going ..i hate myself ❤️,umm social anxiety attack called said not going hate,negative,0.5960507392883301,sadness,0.6882514953613281,irony,0.7194164991378784
Social anxiety can suck my left it I really hate how much it complicates things beyond comprehension,social anxiety suck left really hate much complicates things beyond comprehension,negative,0.979627251625061,sadness,0.9081128239631653,non_irony,0.8440566658973694
I fucking hate my social anxiety,fucking hate social anxiety,negative,0.9794856905937195,anger,0.8860679268836975,irony,0.6653470993041992
i hate how much social anxiety i have,hate much social anxiety,negative,0.7980219125747681,sadness,0.9603085517883301,irony,0.7292877435684204
@jordynbbell Yea I understand. I have social anxiety as well and I hate being in large groups. A lot of times I won’t speak first it makes me nervous. I try to get out of my comfort zone but then I start having an internal battle.,yea understand social anxiety well hate large groups lot times speak first makes nervous try get comfort zone start internal battle,negative,0.7652589082717896,sadness,0.8375131487846375,non_irony,0.8088783621788025
"depression, anxiety, borderline personality, social anxiety... like, why am i living?? those shit are killing me i hate them",depression anxiety borderline personality social anxiety like living shit killing hate,negative,0.9761179685592651,sadness,0.8845114707946777,non_irony,0.6957502961158752
@reylo_arg @starwars @JimmyKimmelLive He has Social Anxiety ( I have Autism and anxiety) which means we hate social outings. It is really scary. Any questions about this I can answer this.,social anxiety autism anxiety means hate social outings really scary questions answer,negative,0.9152304530143738,sadness,0.9272067546844482,irony,0.6011689305305481
I’ve finally decided I want to go to college (never wanted to to go cause I hate being around too many people #socialanxiety) but don’t know what to go for.. have any ideas?,finally decided want go college never wanted go cause hate around many people #socialanxiety know go ideas,negative,0.6674787402153015,sadness,0.948334813117981,non_irony,0.8943106532096863
"@anne_theriault Most notably a constant fear that even my closest people secretly hate me. The awareness that this is social anxiety thing and therapy have helped a lot, but it still crops up.",notably constant fear even closest people secretly hate awareness social anxiety thing therapy helped lot still crops,negative,0.6733221411705017,sadness,0.9592385292053223,irony,0.6383747458457947
it’s so fucking obvious my friends don’t wanna see my catch me crying i hate myself so much fuck social anxiety fuck it,fucking obvious friends wanna see catch crying hate much fuck social anxiety fuck,negative,0.9814441800117493,anger,0.7585282325744629,irony,0.6791462302207947
I hate being in social groups that force you to be interactive. Like my anxiety is sky rocketing 🚀,hate social groups force interactive like anxiety sky rocketing,negative,0.9212774634361267,anger,0.73487389087677,irony,0.9557360410690308
i’ve got crippling social anxiety but does it stop me from constantly replying to mutuals that probs hate me? no. it does not.,got crippling social anxiety stop constantly replying mutuals probs hate no not,negative,0.9491672515869141,anger,0.8233396410942078,non_irony,0.6847309470176697
i hate that my social anxiety makes me uncomfortable around anyone i don’t know so i try to hide my discomfort by not showing any emotion on my face which i know makes people i’m forced to talk to or greet / see while i’m with a friend assume that i’m a rude bitch,hate social anxiety makes uncomfortable around anyone know try hide discomfort not showing emotion face know makes people forced talk greet see friend assume rude bitch,negative,0.9636495113372803,anger,0.8934361338615417,non_irony,0.8247042894363403
"Why did i make this shirt i hate having the attention on me

My social anxiety prevents me from wearing it",make shirt hate attention social anxiety prevents wearing,negative,0.8649847507476807,sadness,0.8436591029167175,irony,0.9204545617103577
"social anxiety rlly has me out here procrastinating calling my doctor to reschedule an appointment i fuckin missed and lowkey losing my shit over it bc ""what if theyre mad at me and hate me now uhhh...what if i just never went back!!!"" and i crave death",social anxiety rlly procrastinating calling doctor reschedule appointment fuckin missed lowkey losing shit bc theyre mad hate uhhh never went back crave death,negative,0.98158198595047,anger,0.9661434888839722,non_irony,0.741428017616272
"This app sucks. It brings nothing but anxiety, hate, and social conflict to this country and the world. It rewards people for praising themselves or trying to find clever ways to hurt others. People think they can say whatever they want because they are hiding behind a screen. &gt;&gt;",app sucks brings nothing anxiety hate social conflict country world rewards people praising trying find clever ways hurt others people think say whatever want hiding behind screen gt gt,negative,0.9425773024559021,anger,0.8034660816192627,irony,0.7476349472999573
"I always hate when I have to lay low and work on music at home, instead of being out and supporting other local artists cause my social anxiety is wildin. It’s a struggle.",always hate lay low work music home instead supporting local artists cause social anxiety wildin struggle,negative,0.9500977993011475,sadness,0.8404163122177124,non_irony,0.6224470734596252
Anybody else have social anxiety? I know it makes me look like I hate people but that’s so not true😅,anybody else social anxiety know makes look like hate people not true,negative,0.8433980941772461,anger,0.6716530323028564,non_irony,0.6939899325370789
