renderedContent,pre_processed,label_sentiment,probability_sentiment,label_emotion,probability_emotion,label_irony,probability_irony
Sometimes I really hate my social anxiety,sometimes really hate social anxiety,negative,0.9667944312095642,sadness,0.9199264645576477,irony,0.8559435606002808
i hate social anxiety omg 😓😓😓,hate social anxiety omg,negative,0.9729353189468384,sadness,0.9200863838195801,irony,0.5362886190414429
"Social anxiety says ""stay home all day and do nothing""
But depression says ""idiot why do you stay home all day I hate you""",social anxiety says stay home day nothing depression says idiot stay home day hate,negative,0.9027223587036133,sadness,0.7677004337310791,irony,0.6381622552871704
"In the space of an hour I've gone from drunk, to pounding migraine and social anxiety, I fucking hate myself",space hour gone drunk pounding migraine social anxiety fucking hate,negative,0.9754444360733032,anger,0.8517547249794006,non_irony,0.6395898461341858
"I love leaving the house (lol jk… fucking HATE it)

Took a quick jaunt into town today and lit about $25-$30 on fire today in celebration of my #socialanxiety. Had a solid 2 opportunities after realizing it within 1 min of paying but.....
#fuckit
#goinghome
#notworthanothermin",love leaving house lol jk fucking hate took quick jaunt town today lit fire today celebration #socialanxiety solid opportunities realizing within min paying #fuckit #goinghome #notworthanothermin,negative,0.3459618091583252,anger,0.8317933678627014,non_irony,0.7039632797241211
"I used to not have social anxiety, but now I hate when people invite me places especially if they are not open",used not social anxiety hate people invite places especially not open,negative,0.9222301244735718,anger,0.7003148794174194,non_irony,0.8464588522911072
@depressionnote This is me I hate social anxiety 😓,hate social anxiety,negative,0.9546524286270142,sadness,0.8515599966049194,irony,0.712561845779419
"Well I’m sitting here talking to you lot cus no one here is talking to me. I hate social gatherings. Hate crowds, hate loud music. Anxiety kicking in. Socially awkward and out of place.",well sitting talking lot cus no one talking hate social gatherings hate crowds hate loud music anxiety kicking socially awkward place,negative,0.9440927505493164,sadness,0.576791524887085,irony,0.624032199382782
"On June 7, I gave my graduation speech, and it was one of the best days of my life. I hate public speaking, and I’ve got pretty bad social anxiety, but I had a story to tell, and it resonated with a lot of people, and I will always be extremely grateful for this experience.",june gave graduation speech one best days life hate public speaking got pretty bad social anxiety story tell resonated lot people always extremely grateful experience,positive,0.8942983746528625,joy,0.772564172744751,non_irony,0.6463901400566101
"The worst part of my social anxiety is that I care too much about what other people think of me. That I feel like they constantly Judge me. And I HATE it that I now feel about gacha games this way, too. Idol Twt is so toxic, man",worst part social anxiety care much people think feel like constantly judge hate feel gacha games way idol twt toxic man,negative,0.9639321565628052,anger,0.4890954792499542,non_irony,0.6587303280830383
"I’m super excited for #WINNERCROSSTOURManila because..
1. It’s my first concert ever
2. I have social anxiety, so I hate crowd
3. I’m ignoring any fear of anxiety attack
4. I started listening to kpop in early 2019
5. I became winner’s fan 6-7 months ago

Everything is new! 😂😂",super excited #winnercrosstourmanila first concert ever social anxiety hate crowd ignoring fear anxiety attack started listening kpop early became winner fan months ago everything new,positive,0.9327965378761292,joy,0.914772093296051,irony,0.755847692489624
"@faby07a @Bobby19_ @Merry_Mid Literally he tries to be humble and people shit on him for that, he buys expensive shit y’all shit on him for that too. Nobody’s ever pleased with him and it’s sad. He even says he doesn’t log on to twitter or even on social media a lot in general bc he get anxiety from the hate",literally tries humble people shit buys expensive shit shit nobody ever pleased sad even says doesn log twitter even social media lot general bc get anxiety hate,negative,0.9775136709213257,sadness,0.6801896691322327,non_irony,0.6872848272323608
"@AlanCaryLiddell @neil6701 @CNN I've spent a great deal of my career trying to help people, with depression, anxiety disorders, bipolar disorder etc. The reason social workers and councelers have such burnout is, and I hate to say this, but some people are beyond your help. At least my help. Good talk.",spent great deal career trying help people depression anxiety disorders bipolar disorder etc reason social workers councelers burnout hate say people beyond help least help good talk,neutral,0.48116791248321533,sadness,0.9039269089698792,irony,0.8161946535110474
"@The_STJ_Way I get what you’re saying. I have social anxiety really bad and I hate attention. But, I have my days when I’m comfortable being exposed. I’m comfortable talking to people. I’m comfortable just being myself. And then there are those down or depressings days.",get saying social anxiety really bad hate attention days comfortable exposed comfortable talking people comfortable depressings days,negative,0.8216219544410706,sadness,0.9506576657295227,irony,0.8149174451828003
i hate being in social situations with no alcohol  #socialanxiety,hate social situations no alcohol #socialanxiety,negative,0.9132982492446899,sadness,0.9223224520683289,non_irony,0.8341480493545532
also i really hate social anxiety i hate it so much,also really hate social anxiety hate much,negative,0.9784106612205505,sadness,0.53439861536026,non_irony,0.640594482421875
I have such bad social anxiety I had a panic attack and had to pull over on the highway... I hate being like this,bad social anxiety panic attack pull highway hate like,negative,0.9335810542106628,sadness,0.7869957089424133,non_irony,0.5407349467277527
@Garrett_Watts This was at my work Christmas party. I have social anxiety hate small talk but decided to get out of my comfort zone and go. https://t.co/tu4baKzO14,work christmas party social anxiety hate small talk decided get comfort zone go,negative,0.7427555918693542,sadness,0.9341377019882202,non_irony,0.666962206363678
I hate how ppl misuse depression and anxiety... like don’t claim something you know you couldn’t handle in real life just to get social media clout 🙄 shits annoying,hate ppl misuse depression anxiety like claim something know handle real life get social media clout shits annoying,negative,0.964423656463623,anger,0.9443527460098267,irony,0.6304630041122437
idk how most social anxiety peeps find comfort online. part of why i hate texting is that i cant read the tone. why is socialising irl a million times easier than doing it online. i get instant feedback when i say words,idk social anxiety peeps find comfort online part hate texting cant read tone socialising irl million times easier online get instant feedback say words,neutral,0.45301517844200134,sadness,0.9018582105636597,irony,0.5305215120315552
@Yenssy_Cruz Me never goin back to that salon b/c I hate attn n have social anxiety,never goin back salon hate attn social anxiety,negative,0.9154635071754456,sadness,0.7643283605575562,non_irony,0.83623206615448
"Unlike you  some of us suffer from social anxiety and I personally have no self-confidence, and i hate myself for that, however I don’t need someone to attack me directly or indirectly just for the clout. And don’t worry i fear rejection so no need for me to handle it. twitter.com/candyflissa/st…",unlike us suffer social anxiety personally no self confidence hate however need someone attack directly indirectly clout worry fear rejection no need handle,negative,0.8743979930877686,sadness,0.9394860863685608,non_irony,0.8608985543251038
I fucking hate social anxiety and I can't describe it to my mom. Because she can't understand,fucking hate social anxiety describe mom understand,negative,0.9788869023323059,anger,0.8741411566734314,non_irony,0.6084986329078674
"fuck replying to tweets unwarrented is hard, i srsly really hate my social anxiety sometimes",fuck replying tweets unwarrented hard srsly really hate social anxiety sometimes,negative,0.9795029759407043,anger,0.6071425080299377,non_irony,0.7264095544815063
I hate when people I haven’t spoken to since high school send me invites to come to an event at their house. I’m sorry I can’t I have social anxiety now.,hate people spoken since high school send invites come event house sorry social anxiety,negative,0.9149444103240967,sadness,0.5006064176559448,irony,0.5275333523750305
I hate social anxiety(∩︵∩),hate social anxiety,negative,0.9546524286270142,sadness,0.8515599966049194,irony,0.712561845779419
My social anxiety is knocking on the door because new years eve is coming and I HATE parties so I guess I just gotta let her in,social anxiety knocking door new years eve coming hate parties guess gotta let,negative,0.7754020094871521,sadness,0.6137153506278992,non_irony,0.5153458118438721
"@chameleosaurus Es que escrito y tal suena super borde y la cultura del hate de las cosas populares me parece una cagada y no quería que lo entendierais en plan ""mimimimi""

Is this Twitter social anxiety?",es que escrito tal suena super borde la cultura del hate de las cosas populares parece una cagada no quer que lo entendierais en plan mimimimi twitter social anxiety,neutral,0.5002077221870422,anger,0.6000438332557678,irony,0.590661883354187
@SEXXYSAMEER / exhales ive tried baksk my social anxiety is like nooe everyone will hate u ooc for ic so i advert,exhales ive tried baksk social anxiety like nooe everyone hate ooc ic advert,negative,0.9282018542289734,sadness,0.8441844582557678,non_irony,0.5859016180038452
"Jar of zerglings LUL
A little bit social anxiety and afraid of public speaking,sometimes.
I hate my life. https://t.co/WZSkABdQks",jar zerglings lul little bit social anxiety afraid public speaking sometimes hate life,negative,0.8595484495162964,sadness,0.9568538665771484,non_irony,0.7192233204841614
"@technoblad honestly me too... I also have social anxiety and it's just ah, I barely talk ;-; and I hate that about myself. like I want to be outgoing and be easy to talk to :(",honestly also social anxiety ah barely talk hate like want outgoing easy talk,negative,0.5409723520278931,sadness,0.8956917524337769,non_irony,0.7943810224533081
@ThaboNdawonde My potential life partner would know I hate public proposals (social anxiety things) so to do it anyway would be a big f-you to my feelings 💔,potential life partner would know hate public proposals social anxiety things anyway would big feelings,negative,0.7964181303977966,sadness,0.7104303240776062,non_irony,0.5623055696487427
I hate my social anxiety cause I don’t feel like myself anymore,hate social anxiety cause feel like anymore,negative,0.9623041152954102,sadness,0.8545138835906982,non_irony,0.6081982851028442
i hate social anxiety helpjz n:(((((,hate social anxiety helpjz,negative,0.8930008411407471,sadness,0.9605609178543091,non_irony,0.7743165493011475
Yoooo I hate having social anxiety lmaoooo,yoooo hate social anxiety lmaoooo,negative,0.9609647393226624,anger,0.8084833025932312,non_irony,0.50921231508255
"You know out of everyone I went to highschool with I never thought I'd be the depressed uni girl who goes out once a decade cause they hate themselves that much and has terrible social anxiety
Really didn't see it coming",know everyone went highschool never thought depressed uni girl goes decade cause hate much terrible social anxiety really didn see coming,negative,0.9355471730232239,sadness,0.9694969654083252,irony,0.6874938011169434
"I really hate this nasty feeling of seeming off-putting to others.

I know some friends will jump in and say otherwise, but I remain feeling like a bad apple when my mind races with [social] anxiety...",really hate nasty feeling seeming putting others know friends jump say otherwise remain feeling like bad apple mind races social anxiety,negative,0.9646872282028198,anger,0.727962076663971,non_irony,0.6843212842941284
"Dont know if it’s because of social anxiety or what but I absolutely hate going to other peoples houses instead of mine. I hate asking for food, water etc. but at my own house I can wander around and fulfill my needs. It’s different if we’re close, otherwise my place is necessary",dont know social anxiety absolutely hate going peoples houses instead mine hate asking food water etc house wander around fulfill needs different close otherwise place necessary,negative,0.9393541812896729,sadness,0.8544711470603943,non_irony,0.9324662685394287
"Perks of being married to me:

- Won't cheat because I have social anxiety and hate leaving the house
- Unlimited supply of dick jokes
- Easy to feed as only likes chicken nuggets
- Bomb ass pussy
- Won't ever beat you at a video game because I'm terrible at them twitter.com/UnicornHairz/s…",perks married cheat social anxiety hate leaving house unlimited supply dick jokes easy feed likes chicken nuggets bomb ass pussy ever beat video game terrible,negative,0.9657856225967407,anger,0.9391210675239563,non_irony,0.5551114678382874
"My interests and friend groups are all over the place.. hella into anime but also a carnival junkie, love traveling hate trying new foods, very friendly and social but also almost always depressed and with crippling anxiety 🙂 so fun. So diverse.",interests friend groups place hella anime also carnival junkie love traveling hate trying new foods friendly social also almost always depressed crippling anxiety fun diverse,negative,0.4504442811012268,sadness,0.5739896893501282,non_irony,0.5842540860176086
I hate complaining about my social anxiety I just feel like a big brat baby,hate complaining social anxiety feel like big brat baby,negative,0.9510596394538879,sadness,0.7030796408653259,irony,0.8040586709976196
@zopdyke @Subtronics 😭😭😭 DAMMIT i hate having social anxiety😂,dammit hate social anxiety,negative,0.9750770926475525,anger,0.6854022145271301,irony,0.6854440569877625
you don’t have social anxiety they actually hate you,social anxiety actually hate,negative,0.9749675989151001,anger,0.5756590962409973,irony,0.6934999823570251
"Twitter was actually once extremely toxic for me and I spent a lot of time either upset, worried, or with anxiety, (worse then my extreme social anxiety already is) simply because I can never be the type of person who isn't affected by hate, and it's not just hate on me that's +",twitter actually extremely toxic spent lot time either upset worried anxiety worse extreme social anxiety already simply never type person affected hate not hate,negative,0.9757503271102905,sadness,0.7079164385795593,non_irony,0.9155774116516113
"The really stupid thing about having social anxiety is that I’m okay in front of a camera or in person with small groups 1 on 1. Just reaching out and saying “hi, let’s do a video together” has always seemed like I’m pushing myself on others. And I HATE doing that.",really stupid thing social anxiety okay front camera person small groups reaching saying hi let video together always seemed like pushing others hate,negative,0.8472571969032288,anger,0.8939289450645447,irony,0.8609699010848999
i hate the fact i have social anxiety,hate fact social anxiety,negative,0.9378407597541809,sadness,0.7643961310386658,irony,0.8742972016334534
I suck at starting a conversation with women. I hate my social anxiety!,suck starting conversation women hate social anxiety,negative,0.9748945832252502,anger,0.9232434034347534,irony,0.827609658241272
"The way my social anxiety is set up, I hate going places where I only know one person because I would hate to be up underneath them like they’re my parent cause I’m scared to make new friends 😂",way social anxiety set hate going places know one person would hate underneath like parent cause scared make new friends,negative,0.8737567663192749,sadness,0.8600137233734131,non_irony,0.7737572193145752
I have the worst social anxiety. When people talk to me idk what to say back lmao. I hate it. How do I fix it ? Hahah,worst social anxiety people talk idk say back lmao hate fix hahah,negative,0.9431419968605042,anger,0.49973613023757935,non_irony,0.8445731401443481
Why am I such a shit person. I hate that my MH makes me so less social and I always get called out on it. I wish my anxiety didn't stop me having fun. But what's worse is that my best friend just said he's so disappointed in me 😔,shit person hate mh makes less social always get called wish anxiety didn stop fun worse best friend said disappointed,negative,0.9656046628952026,sadness,0.5965356230735779,non_irony,0.6494837999343872
i hate being an introvert not in that harry potter livejournal kinda way where i feel oppressed for having anxiety i just haven't hung out with anyone in a few days and i'm chill with that but i'm DEFINITELY getting loopy like legiterally crazy with my atrophying social skills,hate introvert not harry potter livejournal kinda way feel oppressed anxiety hung anyone days chill definitely getting loopy like legiterally crazy atrophying social skills,negative,0.941703736782074,sadness,0.9478772878646851,non_irony,0.8924552202224731
And I hate when ppl try and force me to go out. Like chill bro. You keep inviting me to shit and my social anxiety is like https://t.co/hAk1NrLqzU,hate ppl try force go like chill bro keep inviting shit social anxiety like,negative,0.9689120650291443,anger,0.9538454413414001,irony,0.5744526982307434
I hate how social media can be so anxiety provoking,hate social media anxiety provoking,negative,0.9673506021499634,anger,0.6338816285133362,irony,0.5765544176101685
Y’all can’t talk about Summer Walker having social anxiety and in the same breath hate when a large group of people sings happy birthday to you...,talk summer walker social anxiety breath hate large group people sings happy birthday,negative,0.6236875057220459,sadness,0.7722432017326355,irony,0.902553141117096
@notcapnamerica I struggle with this a bit myself. I think it might be a symptom of anxiety or ADHD🤔. Or both (diagnosis in 2020). I hate leaving my apartment and being social is really hard. I mostly show up for work &amp; church. That's what I go outside for.,struggle bit think might symptom anxiety adhd diagnosis hate leaving apartment social really hard mostly show work amp church go outside,negative,0.854993999004364,sadness,0.9707063436508179,non_irony,0.9209686517715454
Gotta say all this transphobic hate is getting to me a little. I don’t have a thick skin. I have social anxiety and depression issues. People saying it’s biology are driving me crazy. I wish they could live as me for a day and then maybe they would understand. #transgender #ftm🥺,gotta say transphobic hate getting little thick skin social anxiety depression issues people saying biology driving crazy wish could live day maybe would understand #transgender #ftm,negative,0.9390681982040405,sadness,0.7454688549041748,irony,0.5649969577789307
i hate social anxiety,hate social anxiety,negative,0.9546524286270142,sadness,0.8515599966049194,irony,0.712561845779419
i hate how much anxiety i have about putting myself on social media. each day i get more anxious and just feel like i’m being judged all the time :/,hate much anxiety putting social media day get anxious feel like judged time,negative,0.7452141046524048,sadness,0.9626224040985107,non_irony,0.5190377831459045
"God help me improve my relationship with snaps and videos, I really hate random snaps..... I generally hide behind having social anxiety 

But truth be told my mental image of me and what I see on  images  are always at war 

Maybe an image consultant would be ideal twitter.com/Fact/status/12…",god help improve relationship snaps videos really hate random snaps generally hide behind social anxiety truth told mental image see images always war maybe image consultant would ideal,negative,0.5841693878173828,sadness,0.9187899827957153,non_irony,0.502426028251648
"i know this is not a big deal but for my social anxiety it kind of is, i hate having to share a bathroom with strangers :(",know not big deal social anxiety kind hate share bathroom strangers,negative,0.7580306529998779,sadness,0.9226943850517273,non_irony,0.7486118078231812
I just want to go for a nice drink with friends tonight and no contemplate it every 15 minutes. I hate social anxiety why am I like this,want go nice drink friends tonight no contemplate every minutes hate social anxiety like,negative,0.4432644546031952,sadness,0.9444205164909363,non_irony,0.8898013830184937
I am SO FUCKING DONE caring what other people think my social anxiety makes me feel like a fucking piece of shit and makes me act like a fucking piece of shit towards people I love because I hate being seen a certain way well guess what? FUCK YOUVsocial anxiety I dont give a fuck,fucking done caring people think social anxiety makes feel like fucking piece shit makes act like fucking piece shit towards people love hate seen certain way well guess fuck youvsocial anxiety dont give fuck,negative,0.9801245927810669,anger,0.9716010093688965,irony,0.5235722064971924
why does my social anxiety hATE mEEEEE https://t.co/zedAHHz4Mj,social anxiety hate meeeee,negative,0.9784090518951416,anger,0.708679735660553,non_irony,0.6429530382156372
I really hate my self for having a social anxiety,really hate self social anxiety,negative,0.9723780751228333,sadness,0.8536142706871033,irony,0.7542122602462769
Idk why but I get a lot of anxiety when people talk about how much they hate a movie on social media,idk get lot anxiety people talk much hate movie social media,negative,0.9032567143440247,sadness,0.8567103147506714,irony,0.5065025687217712
I literally hate being the first one of a group to arrive. Because I will not walk in... I think it does something with my social anxiety... 😩🥴,literally hate first one group arrive not walk think something social anxiety,negative,0.9324777126312256,anger,0.817807137966156,non_irony,0.8209097981452942
I hate my inability to carry a conversation bc of my social anxiety but I’m dying to be friends w this pretty girl :((( trust me after a few months I won’t be so shy come bacccc!!!,hate inability carry conversation bc social anxiety dying friends pretty girl trust months shy come bacccc,negative,0.8638533353805542,sadness,0.902683436870575,non_irony,0.8526931405067444
"I hate so much when people say that they are depressed when they ase just sad.
I hate when peole say they have anxiety when they have ""tummy butterflies"".
I hate when people say they have social anxiety when they dont have fun when they hang out.

You dont have idea, stfu.",hate much people say depressed ase sad hate peole say anxiety tummy butterflies hate people say social anxiety dont fun hang dont idea stfu,negative,0.9727813005447388,sadness,0.6403708457946777,non_irony,0.7058449983596802
I hate how hard it is for me to make friends online and in real life :( social anxiety is snazzy am I right 😥,hate hard make friends online real life social anxiety snazzy right,neutral,0.4590037763118744,sadness,0.9158555865287781,non_irony,0.5129256844520569
@starmama_saturn I also hate the whole you don’t owe anyone anything rhetoric as well. Because it’s definitely not entitlement I just want to make sure that your alive and mentally  and physically well. I have social anxiety so I’m definitely not “dependent on communication” or whatever she said,also hate whole owe anyone anything rhetoric well definitely not entitlement want make sure alive mentally physically well social anxiety definitely not dependent communication whatever said,negative,0.7715883255004883,anger,0.8991800546646118,non_irony,0.9215198755264282
"@Ioveskoo 20 people? r u kidding me? Do u think if only 20 people attacked them, the staff would have blocked their comments? The hate they received was too strong, that a member ended up having anxiety on social networks",people kidding think people attacked staff would blocked comments hate received strong member ended anxiety social networks,negative,0.8017255067825317,anger,0.8158863186836243,irony,0.6400254368782043
They make fun of Summer’s social anxiety and they twist her words. She always have to explain herself and people still hate. They try to come for Meg’s height and try to make her seem like a problematic bitch when she’s not.,make fun summer social anxiety twist words always explain people still hate try come meg height try make seem like problematic bitch not,negative,0.7005032896995544,anger,0.8195820450782776,irony,0.8458601832389832
My social anxiety has spiked so bad that the easiest shit like calling to make appointments is hard again. I can’t talk to even my family I want to be alone all the time and I hate being alone,social anxiety spiked bad easiest shit like calling make appointments hard talk even family want alone time hate alone,negative,0.96389240026474,sadness,0.6921760439872742,non_irony,0.5462231636047363
I hate how my social anxiety just kicks in mid groove. Mxm,hate social anxiety kicks mid groove mxm,negative,0.9167272448539734,sadness,0.8800411224365234,non_irony,0.5286005735397339
social anxiety disorder fucking SUCKS. Like I can be all cool and normal in your dms but be the most anxious and nervous wreck when you‘re meeting me and I HATE THAT,social anxiety disorder fucking sucks like cool normal dms anxious nervous wreck meeting hate,negative,0.9826595783233643,anger,0.7052799463272095,irony,0.719917893409729
